original,paraphrase
Novost je bilo enodnevno slikanje miniature,Novost je bila enodnevna slika v miniaturi.
"Franc Vozel je občutljiv poet človeškega telesa. Z barvnimi in ploskovnimi razmerji ustvarja razpoloženje, v katerem se človeško telo ali njegovi liki pokažejo v liričnem, a tudi polnokrvnem odnosu do svoje drže. Jože Tisnikar je že veteran slovenske likovne scene in njegovi motivi so že na daleč razpoznavni. Toda vsakič znova lahko odkrijemo, če ne drugje, pa v očesu njegovih krokarjev, nov odblesk in novo potezo s čopičem.","Franc Vozel je občutljiv pesnik človeškega telesa. S svojo barvo in površinskimi razmerji ustvarja razpoloženje, v katerem se človeško telo ali njegovi liki kažejo v liričnem, a tudi polnokrvnem odnosu do svoje drže. Jože Tisnikar je že veteran slovenske likovne scene in njegovi motivi so že široko prepoznavni. Vendar pa lahko vsakič, ko v očeh njegovih krokarjev odkrijemo, če ne drugje, novo svetlikanje in novo potezo čopiča."
Hrvaška arhitektura v Celju,Hrvaška arhitektura v Celju
"Pred nami je torej zanimiv kulturni dogodek, ki bo vsaj malo pomagal poživiti v zadnjem času kar prelene kulturne tokove med Celjem in ne tako daljno Hrvaško oziroma Zagrebom, zato je poteza dveh muzejev v Dnevih evropske kulturne dediščine še kako dragocena.","Veselimo se zanimivega kulturnega dogodka, ki bo pripomogel k poživitvi v zadnjem času lepih kulturnih tokov med Celjem in ne tako oddaljeno Hrvaško ali Zagrebom, zato je gesta obeh muzejev na Dnevih evropske kulturne dediščine zelo dragocena."
Za slovo celovečerni koncert Münchenerjugend Orkester,Za poslovilni celovečerni koncert Münchenrugend Orkester
