original,paraphrase
"Reči hoče: analizirajva potovanje tegale filmčka o odnosih Nemške demokratične republike z Ljudsko republiko Kitajsko, vse od stasijevskega glavnega stana do Bedford Squara. Povejte mi, kakšne skrivne pripomočke je uporabil Saša in kje jih je dobil. Ima res tako neoviran dostop do stasijevske tehnične trgovine? Lahko res kadar koli stopi vanjo, sune kos Yardleyjevega mila z odtisom ključavnice ali zvitek nerazvitega mikrofilma, ne da bi kdo zavpil: »Hej!«? Nato pa obdelajva trenutek, ko ta isti zvitek filma izroči prijatelju Teddyju.",": On pomeni, da analizira pot tega kratkega filma o odnosih Nemške demokratične republike z Ljudsko republiko Kitajsko, od sedeža Stasi na Bedford Square. Povej mi, kaj skrivnost Sasha pripomočki, ki se uporabljajo in kje jih je dobil. Ali ima tako neoviran dostop do tehnične trgovine Stasi? Ali je res korak v vsakem trenutku, suniti kos Yardley mila z odtisom zaklepanje ali roll nerazvitega mikrofilma, ne da bi kdo kričal: ""Hej ""? Potem pojdimo čez trenutek, ko je daje to isto roll filma svojemu prijatelju Teddy."
"In Ted napenja možgane, da bi Rourku opisal vsako najmanjšo podrobnost. Morda je kriva nečimrnost, toda res se mu zdi, da svoje znanje opisuje za poznejše rodove. Ne za zvijačnega Profesorja, ampak za mlade vohune, novince v poslu, ki bodo nekoč brali dosje o sodelovanju med Sašem in Mundyjem takrat bo najbrž že javno dostopen in strmeli nad njuno briljantnostjo, nad preprosto lepoto njune iznajdljivosti. Poleg tega Rourke ni Profesor. Rourke je zmožen slediti tako toku kot protitoku, medtem ko Profesor, hvalabogu, lahko spremlja le nasprotni tok.","To je lahko nečimrnost, vendar se mu zdi, da je opisuje svoje znanje za poznejše generacije. Ne za zvito profesorja, ampak za mlade vohune, novinci v podjetju, ki bo nekega dne prebral dokumentacijo o sodelovanju med Sasha in Mundy, potem bo verjetno javno na voljo in strmel v njihovo briljantnost, preprosta lepota njihove iznajdljivosti. Poleg tega, Rourke ni profesor. Rourke je sposoben slediti tako tok in nasprotni tok, medtem ko profesor, hvala Bogu, lahko spremlja le nasprotni tok."
"Luger? Bernie? Seveda sem ga srečal! pomisli Mundy. In na tisto življenjsko obdobje, če je čisto iskren, ni ravno ponosen, saj je popoldneve preživljal v postelji z njegovo Nito, medtem ko je Bernie visoko na lestvi z napalmom zažigal Minnesoto. A se hitro zbere. Ne vzklikne niti ne zardi. Vohun je, gojenec edinburške šole lepega vedenja, dobro se zna pretvarjati.","seveda sem ga spoznala ""Think Mundy"". in v tem obdobju življenja, če sem iskrena, ni preveč ponosen, ker je svoje popoldneve preživel v postelji s svojo Nito, medtem ko je Bernie z napalmom požigal Minnesoto visoko na lestvi, ampak se hitro zbere, ne kriči in ne zardi, je vohun, študent Edinburške šole lepega vedenja, zna se dobro pretvarjati."
"»Torej nič takšnega, ne? Nobene usluge. Nobenega drobnega opravila. Prav odleglo mi je.«","""torej ni takih stvari, nobenih uslug, nobenih majhnih služb, odleglo mi je."""
Nobenega izhoda ni več. Mora vprašati: »Zakaj? Kaj pa sta si naprtila?«,"Iz tega ni izhoda. Vprašati se mora: ""Zakaj?"
"»Ti je rekel, da si slika?«","""Ali ti je rekel, da si slika?"""
"»Verjetno. Povabil me je, naj grem prihodnji teden z njim v Glyndebourne. Prišlo mi je na misel, da bi te vprašal za mnenje.«","""Verjetno. Povabil me je, naj grem naslednji teden z njim v Glyndebourne in pomislila sem, da bi vas vprašala za mnenje."""
»Ne.«,"""Ne."""
"»Na priporočilo Orvilla J. Rourka je Cia dobrohotno sklenila, da si lojalen britanski agent, dvojni, a ne trojni. In da je tak tudi Saša, čeprav je Nemec in nor.« Na lepem ga pograbi jeza, kar pri njem ni pogosto. »Za božjo voljo, nehaj že gledati, ko da bi ti kdo ukradel pudlja! To je bila upravičena bojazen. Dobro delo je opravil. Čist si ko solza.«","""na priporočilo Orville J. Rourkeja, je CIA prijazno zaključila, da si zvest britanski agent, dvojni agent, ne pa tudi trojni agent, in da je Sasha, čeprav je Nemec in nor, prav tako takšen."" Nenadoma se razjezi, kar se pri njem ne zgodi pogosto. ""za božjo voljo, nehajte gledati, ko nekdo ukrade vaš pudelj To je bil legitimen strah. Dobro delo je opravil. čisti ste kot solza."""
"Tako se Mundy neke gluhe noči z očali za nočno gledanje znajde na močvirnatem obmejnem terenu, ki so ga za nekaj ur pustili nezastraženega, na ljubo neznanemu stasijevskemu agentu iz Zahodne Nemčije, ki se mora za krajši čas sestati s svojim nadzornikom pa čeprav Saša s tem samo speljuje vodo na svoj mlin.","Tako se, neke gluhe noči, Mundy, ki nosi očala za nočno gledanje, znajde v močvirnatem obmejnem območju, za nekaj ur ostane nezastražen, zavoljo neznanega Stasijevega agenta iz Zahodne Nemčije, ki se mora za kratek čas srečati s svojim nadzornikom, čeprav Saša samo črpa vodo do svojega mlina."
"Pri vratih ga dekleta poljubijo, Amory pa mu, kakor ponavadi, reče, naj se pazi.","Pri vratih ga poljubita dekleti in Amory mu kot običajno reče, naj se pazi."
"Z jezo in sovraštvom pride tudi premetenost. Saša je ujetnik buržoazne fašistične države, ki se predstavlja za delavski raj. Da bi premagal ječarje, uporablja njihovo lastno podlo orožje. Pritaji se, skriva in dobrika. Da bi jih zadel v samo srce nezakonite oblasti, jim krade tisto, kar jim je bilo najljubše: njihove skrivnosti.","Z jezo in sovraštvom pride subtilnost. Saša je ujetnik buržoazne fašistične države, ki se predstavlja kot delavski raj. Da bi porazil ječarje, uporablja njihovo lastno orožje. Skriva, skriva in pozdravlja. Da bi jih udaril v samo srce nezakonite vlade, jim ukrade tisto, kar jim je bilo najljubše: njihove skrivnosti."
»Pa si se pri tem vsaj malo zabaval ali je bilo vse skupaj samo posel?« ga vpraša Mundy med sprehodom po enem izmed leningrajskih parkov.,"""Si se s tem vsaj malo zabaval ali je šlo samo za posel?"" vpraša Mundy med sprehodom po enem od Leningrajskih parkov."
"»Lepo ga pozdravi in mu reci, da je navadna rit. Zdaj pa pojdiva noter in se ga napijva.«","""pozdravi ga in mu povej, da je kreten."" pojdimo noter in se napijmo. """
"»O, nikar ne krivi ubogega starega Britanskega sveta,« galantno reče Mundy. »Po svoje so bili dobri do mene. Niso oni krivi.«","""Oh, ne krivi ubogi stari britanski svet,"" mundy galantno pravi. ""prijazni so bili do mene, to ni bila njihova krivda."""
"Mundy je bolj ali manj počel natanko to, a je prevljuden, da bi ji priznal. Dogovorita se, da se o denarju ne bosta pogovarjala. Oba si bosta poiskala dobrega odvetnika.","Mundy je bolj ali manj naredil ravno to, ampak je preveč vljuden, da bi to priznal in se strinjata, da ne bosta govorila o denarju in oba dobita dobrega odvetnika."
"»Kako pa to, da si že tako zgodaj doma?« sumničavo vpraša Mundy.","""kako to, da si tako zgodaj doma?"" se sumljivo sprašuje Mundy."
»Zakaj? Kaj pa si ušpičil?«,"""Zakaj? Kaj si naredil?"""
"»Preverili smo, kaj pa misliš, da delamo? Preiskali smo njegovo stanovanje in prestrašili sosede. Splošno mnenje je, da je pravi čas ugotovil, kam piha veter, in jo pobrisal, še preden ga je kdo s kolom po glavi ali kaj že tam počnejo.«","""preverili smo, kaj mislite, da počnemo? preiskali smo njegovo stanovanje in prestrašili sosede. splošni občutek je, da je ugotovil, kje je veter pihal v času in ga obrisal, preden ga je nekdo brcnil v glavo ali kaj so tam počeli."""
"v hotelu Dreesen v Bad Godesbergu sem rezerviral dva razkošna apartmaja na tvoje ime, za osemnajstega zvečer. Vzemi vse, kar premoreš, a pridi sam. Gospodu Arnoldu nisem hotel reči ne zdravo ne zbogom, jebe naj se. V Husum sem prišel, da bi se prepričal, ali je Herr Pastor res pokopan. Tako zelo mi je žal, da je mrtev, da ne more videti navdušujočega prizora, ko naš ljubljeni firer anektira Vzhodno Nemčijo z vsemogočno nemško marko. ","rezerviral sem dva luksuzna apartmaja v hotelu Dreessen v Bad Godesbergu za vaše ime, za osemnajsti večer. Vzemite vse, kar imate, vendar pridite sami. Nisem hotel pozdraviti gospoda Arnolda, ne adijo, jebeš. Prišel sem v Husum, da se prepričam, da je gospod Pastor res pokopan. Žal mi je, da je mrtev, da ne more videti vznemirljivega prizora našega ljubljenega firerja, ki je priključil Vzhodno Nemčijo z vsemogočno nemško znamko."
"Tvoj brat v Kristusu, ","Tvoj brat v Kristusu,"
"»V mejah zdravega razuma lahko zahtevaš, kar hočeš. Nastanitev kje drugje, novo identiteto, samo reči moraš. Na začetku si jim menda povedal, da nočeš denarja. Ne bodo ti zamerili, če si premisliš.«","""V mejah zdrave pameti lahko zaprosi za tisto, kar hočeš. Nastanitev drugje, nova identiteta, morate samo reči. Na začetku ste rekli, da ne želite denarja. Ne bodo vas krivili, če si premislite."""
"»Globoko sem ganjen. A zakaj se tako trudijo zame, ko sem vendar iztrošena moč?«","""globoko sem ganjen, ampak zakaj se oni tako trudijo zame, ko sem jaz zapravljena moč?"""
"»Morda imajo občutek odgovornosti. Morda ne bi radi videli, da bi se kakor zombi potikal naokoli, po vsem, kar si naredil zanje. Ali pa ne bi radi brali tvojih spominov.«","""imajo lahko občutek odgovornosti, ali pa morda ne želijo videti vas lebdi okoli kot zombi po vsem, kar ste storili za njih Ali pa morda ne želijo brati svoje spomine."""
"»Mislim, da ti bomo lahko priskrbeli kaj boljšega, kot je nočni portir.«","""mislim, da ti lahko priskrbimo nekaj boljšega od nočnega nosača."""
"»Omenjajo možnost, da bi mi kupili partnerstvo v jezikovni šoli. O tem se še pogovarjamo.«","""Omenjajo možnost, da mi kupijo partnerstvo v jezikovni šoli; o tem razpravljamo."""
»Verjetno.«,"""Verjetno."""
"»Čim dlje od četrtega rajha. Nekam, kjer je še vedno upanje.«","""Proč od četrtega rajha, kolikor daleč je mogoče, nekje, kjer je še upanje."""
"Obsedi v naslanjaču, pridno srka iz kozarca s skoraj čistim viskijem, posluša ropot sveta, ki mu nič več ne pripada, okuša praznino lastnega obstoja, sprašuje se, kaj mu je še preostalo, odkar ga je zapustila celo lastna preteklost, in kateri, če sploh kateri del njega je še uporaben in ali ne bi bilo bolje pozabiti na vso zmešnjavo in spet začeti od začetka.","Sedenje v fotelju, pitje svojega polnila viskija, poslušanje ropotanja sveta, ki mu ne pripada več, okušanje praznine lastnega obstoja, spraševanje o tem, kaj mu je ostalo, ker ga je zapustila njegova lastna preteklost, in kateri del njega je še vedno koristen in ali bi bilo bolje pozabiti na vso zmedo in začeti znova."
"»Torej si zadovoljen s svojim življenjem, Teddy,« živahno pripomni, zaposlen pri štedilniku. »Imaš družino, avto in množicam prodajaš neumnosti. Si kakor ponavadi poročen z žensko po svoji izbiri?«","""torej si zadovoljen s svojim življenjem, Teddy, imaš družino, imaš avto, prodajaš neumnosti množicam, in kot po navadi, si poročen z žensko po svoji izbiri?"""
»Trudim se.«,"""trudim se."""
Še eno vprašanje brez odgovora.,Še eno vprašanje brez odgovora.
»Seveda.«,"""Seveda."""
"»Vsa ta leta, kjer koli sem bil, pa naj sem učil ali so me metali ven, zapirali zmeraj si bil moj tajni spovednik. Brez tebe bi bil kdaj pa kdaj pomislil tudi takšni kraji in časi so bili , da se kratko malo nima več smisla upirati.«","""vsa ta leta, kjerkoli sem bil, ne glede na to, ali sem učil ali pa so me vrgli ven, si bil vedno moj tajni spovednik. brez tebe bi se spomnil krajev in časov, kot je ta, da se ni več vredno upirati."""
»Dvomim.«,dvomim v to.
"»Za božjo voljo, Saša! Ti nosiš baretko. Ti si me zvlekel sem. Ti se mi pačiš in nasmihaš ko Mata Hari. Ti mi mečeš moje besede v obraz. Bi torej končno že znesel jajce in mi povedal, kaj, kurca, se greš?«","""za božjo voljo, Saša, na sebi imaš baretko, zvlekla si me sem, smehljaš se in smejiš se kot Mata Hari, moje besede mi mečeš v obraz, tako da bi končno položila jajce in mi povedala, kaj hudiča delaš?"""
"»To je najlažji in najcenejši trik za vsakega voditelja, ki svojo državo z lažnimi pretvezami povede v vojno. Vsakomur, ki zagreši kaj takega, bi bilo treba za vselej prepovedati opravljanje javne funkcije. Pretiravam ali se strinjaš tudi s to izjavo?«","""To je najlažji in najcenejši trik za katerega koli voditelja, ki gre v vojno s svojo državo pod lažnimi pretvezami, in vsakdo, ki počne kaj takega, bi moral biti za vedno prepovedan opravljati javno funkcijo."
»Kako? Kaj se je zgodilo? Je skočil iz torte?«,"""Kako? Kaj se je zgodilo? Ali je skočil iz torte?"""
"»No, za to bi ti tudi jaz polomil noge. In kako je On s številnimi imeni prišel do bogastva?«","""No, za to bi tudi jaz prekinil noge, in kako je On z mnogimi imeni prišel, da je bogat?"""
»Tako mu je torej ime. Dimitri. Poleg drugih imen.«,"""to je torej njegovo ime, Dimitri, med drugimi imeni."""
"»Ja, za nocoj, za naju.«","""da, za nocoj, za naju."""
"»V napačno smer streljaš, Teddy. Ničesar ne izključujem. Tako kot tudi Dimitri.«","""na napačen način streljaš, Teddy, in ničesar ne izključujem, tako kot Dimitri."""
"Toda Saša ga ne pusti pri miru. Njegova gorečnost ne pozna počitka. »Zakaj si tak cinik, Teddy? Nisi še nikdar stal v vrsti za avtobus in po naključju ujel deset besed, ki so v tvojem srcu zganile nekaj, za kar sploh nisi vedel, da je v njem? Veliko srečo sem imel, da sem takrat izrekel teh deset besed. Lahko bi jih bil slišal kjer koli, danes to ve. Ko sem jih izrekel, so jih izgovarjali tudi na ulicah Seattla, Washingtona in v Genovi. Kjer koli napadejo hobotnico korporacijskega imperializma, izgovarjajo iste besede.«","Toda Sasha ga ne bo pustil pri miru. Njegova vnema ne pozna počitka. ""Zakaj si tak cinik, Teddy? Nikoli nisi stal v vrsti za avtobus in po nesreči ujel deset besed, ki so ti mešale v srcu nekaj, za kar sploh nisi vedel, da je bilo v njem? Imel sem veliko srečo, da sem jih takrat lahko povedal kjerkoli, danes jih pozna. Ko sem jih izrekel, so bile izgovorjene tudi na ulicah Seattla, Washingtona in Genove. Kjerkoli napadajo hobotnico korporativnega imperializma, izrečejo iste besede."""
"»Katera izmed tistih, ki jih poznava?«","""katerega od nas že poznamo?"""
»In ti si mu seveda pritrdil.«,"""in seveda si rekla ja."""
»V Parizu.«,"""V Parizu."""
"Džip je nov, velik, ameriški, z veliko kroma in luči. Za krmilom nepremično sedi koščena ženska srednjih let, pokrita z ruto. Mundyja preblisne, da je podobna ženski v širokem plašču iz velurja, ki je nervozno brskala po torbici in iskala ključ vhodnih vrat, ko se je tri ure prej vzpenjal po tistih zavitih stopnicah, toda Sašu na ljubo misel zadrži zase. Ne pozdravijo se. Saša se opoteče iz audija in pomigne Mundyju, naj tudi on izstopi. Ženska še kar nepremično strmi skozi vetrobransko steklo terenskega vozila. Mundy jo pozdravi z »dober večer«, a se ne zmeni zanj.","Jeep je nova, velika, Ameriški, z veliko kroma in svetlobe. Za volanom, koščen, ženske srednjih let, zajeti v šal, sedi negibno. Mundy utripa, da je ona kot ženska v širokem plašču velor, živčno brskanje po njeni torbici in išče ključ do vhodnih vrat, ko se je povzpel na tiste zvite stopnice tri ure prej, vendar ne misli, da sam. Ne pozdravi. Sasha spotakne iz audija in namige, da Mundy priti ven. Ženska strmi skozi vetrobransko steklo terenskega vozila, še vedno negibno. Mundy jo pozdravi z ""dober večer "", vendar ga ignorira."
"»To je Sven, to je Angelo,« reče, kakor da bi mlada moška odslavljal, ne predstavljal. »Iz poprnice mi pobirata mušje drekce. Te dni me mučijo podrobnosti, gospod Mundy. Tako kot Saša sem tudi jaz človek širokih potez. Vojna proti Iraku je bila nezakonita, gospod Mundy. Bila je zločinska in nemoralna zarota. Nobenega povoda ni bilo zanjo, nobenih povezav z Al Kaido, nobenega orožja za množično uničevanje. Zgodbice o sodelovanju med Sadamom in Osamom bin Ladnom so bile navadno sranje s čisto določenim namenom. Stara kolonialna naftna vojna se je preoblekla v križarsko vihro za zahodnjaški način življenja in svoboščine, sprožila pa jo je klika vojnežejnih židovsko-krščanskih geopolitičnih fantastov, ki so ugrabili medije in izrabili ameriško poenajstoseptembrsko psihopatijo.«","""To je Sven, to je Angelo,"" pravi, kot da bi mladi moški odhajali, on ne predstavlja. ""Ti so pobral svoj kakec iz mojega popper. Podrobnosti so me muči te dni, gospod Mundy. Kot Sasha, sem človek širokih funkcij. Vojna proti Iraku je bila nezakonita, gospod Mundy. To je bil zločinski in nemoralno zarote. Ni bilo motiva za to, ni povezave z Al Kaido, ni orožja za množično uničevanje. Zgodbe o sodelovanju med Sadamom in Osama bin Ladnom so bile običajno sranje za zelo specifičen namen. Stara naftna vojna se je spremenila v križarsko vojno za zahodni način življenja in svoboščin, in je bila sprožena z vojnami med klikasto-septemberskimi judovskimi mediji, ki so izkoristili in izkoristili geopolitično fantazijo."""
"»Korakaj, in vneli se ti bodo podplati. Protestiraj, in zabolelo te bo grlo, policaj pa ti bo s škornjem izbil zobe. Vsakdo, ki opozori na laž, je radikalni godrnjač. Ali islamistični antisemit. Ali pa oboje. In če ste zaskrbljeni glede prihodnosti, nikar, lepo prosim, za prvim vogalom je že nova vojna in za nič vam ne bo treba skrbeti, samo prižgite televizor in uživajte v še eni virtualni vojni, ki so jo ljubeznivo omogočili vaša najljubša blagodejna hunta in njeni korporacijski paraziti.« Brez premora zastavi vprašanje: »Kaj, kurca, naj torej storimo, gospod Mundy? Kako naj onemogočimo vaši državi, ali Ameriki, ali kateri koli zajebani državi, da bi svet povedla v vojno na podlagi kupa izmišljotin in laži, ki so v žarki svetlobi dneva videti prepričljive kakor trapasti palčki na vašem vrtu? Kako naj zaščitimo vaša otroka in moje vnuke, da jih ne bi posrkala vojna? Govorim o korporacijski državi in njenem monopolu nad informacijami, gospod Mundy. Govorim o njenem popolnem prikrojevanju objektivne resnice. In sprašujem se, kako, kurca, lahko preobrnemo tok. Vas bi to zanimalo? Seveda bi vas,« reče, še preden lahko Mundy odpre usta. »Pa mene tudi. In vsakega zdravorazumnega državljana sveta. Še enkrat vas vprašam: kaj, kurca, moramo narediti, da bi v politično areno vrnili zdravo pamet in razum, če sta tam seveda sploh kdaj bila?«","""Premakni se in tvoje noge bodo vroče. Protest, in grlo bo bolelo, in policaj bo brcnil zobe ven s škornjem. Vsakdo, ki govori laž je radikalno zlovoljen. Ali islamistični antisemitski. Ali oboje. In če ste zaskrbljeni zaradi prihodnosti, prosim don 't, tam je nova vojna za vogalom in vam ne bo treba skrbeti za nič, samo vklopite televizijo in uživajte v drugi virtualni vojni, prijazno olajšano z vašo najljubšo dobronamerno hunto in njenih korporativnih parazitov."" Brez premora, vprašajte vprašanje: ""Kaj za vraga, bi morali storiti, gospod Mundy Kako naj ustavimo vašo državo, ali Ameriko, ali katerokoli prekleto državo, da ne popelje sveta v vojno na kupu izmišljotin in laži, ki so v žarkih dneva videti tako prepričljive kot neumni palčki na vašem vrtu? Kako lahko zaščitimo vaše otroke in moje vnuke pred vojno? Govorim o korporativni državi in njenem monopolu nad informacijami, gospod Mundy. Govorim o njeni popolni manipulaciji objektivne resnice in sprašujem se, kako za vraga lahko obrnemo tok. Bi vas zanimalo? Seveda, ""pravi, preden Mundy odpre usta."" In jaz tudi. In vsak razumen državljan sveta. Še enkrat vas vprašam: kaj za vraga moramo storiti, da bi v politično areno vrnili zdrav razum in razum, če so bili kdaj tam? """
"Cilj njegovega načrta je nič manj kot ustanovitev razumnega trga svobodnega mišljenja, na katerem bo mogoče govoriti o dejanskih vzrokih za vojne in o načinih, kako jih preprečiti.","Cilj njegovega načrta ni nič manj kot vzpostaviti razumen trg za svobodno razmišljanje, na katerem se lahko razpravlja o resničnih vzrokih za vojne in načinih njihovega preprečevanja."
»Tega nisem rekel.«,"""tega nisem rekel jaz."""
»Le nikoli ga ni bilo dovolj.«,"""Enostavno ni bilo nikoli dovolj."""
"»Ste imeli, recimo, tudi šolske semestre?« nadaljuje Sven. »Recimo, 'zdajle so počitnice, zdajle pa pouk'?«","""ste imeli, bomo rekli, celo šolske semestre?"" nadaljeval Sven. ""Kot,"" to je počitnice zdaj, in šola zdaj? """
"Med pripravljanjem zajtrka, med ljubljenjem, medtem ko pelje Mustafa v šolo in sebe v Linderhof igrat vdanega služabnika pokojnega kralja Ludvika, ko na Zarine proste večere hiti domov, ko jo občuduje in varuje v njeni izjemni inteligentni ranljivosti, ji iz knjižnice prinaša priročnike o materinstvu in uživa v metanju žogice z Mustafom in drugimi otroki ves čas podoživlja svoj nočni obisk na tisti gori, a ga nikomur ne omeni, samo čaka.","Medtem ko pripravlja zajtrk, medtem ko ljubezen, medtem ko je potrebno Mustafa v šolo in sam Linderhof igrati predanega služabnika pokojnega kralja Louisa, kot je rogoz domov Zarina je prost večer, občudovali in jo ščiti v svoji izjemni inteligentni ranljivosti, on prinaša svoje priročnike o materinstvu iz knjižnice in uživa metanje žogo z Mustaf in drugih otrok ves čas, da podoživite svoj nočni obisk te gore, vendar ga ne omenja nikomur, je samo čaka."
"A ko se pripeljeta do parkirišča, kjer je Mundy pustil svojega hrošča, se partijski glas umakne še enemu čustvenemu izbruhu. V svetlobi tik pred zoro se na Saševem navdušenem obrazu leskečejo kapljice znoja.","Toda ko se peljejo do parkirišča, kjer je Mundy pustil svojega hrošča, se glas stranke umakne še enemu čustvenemu izbruhu, ko se kapljice znoja lesketajo na Saševem navdušenem obrazu tik pred zoro."
"Gospod Frinck je pripravil seznam Mundyjevih številnih upnikov. Tudi gospod doktor Eisner ga je preletel. Gospod Frinck poda skrbno pripravljeno izjavo, pač zaradi navzočnosti lepo rejenega gospoda Brandta iz centrale. Ravnanje gospoda Mundyja je nič manj kot vzorno. Vse možnosti je imel, da bi razglasil bankrot; celo spodbujali so ga, naj tako ravna. Toda gospod Mundy je vztrajal. Zdaj lahko poplača vse po vrsti, tudi banko. To je na moč razveseljivo, reče gospod Frinck. Spoštovanja vredno. Zaračunali bodo lahko celo realne obresti, kar je v takšnih okoliščinah še bolj redko.","Gospod Frinck je sestavil seznam številnih Mundijevih upnikov. dr. Eisner ga je tudi pregledal. Gospod Frinck je podal skrbno pripravljeno izjavo zaradi prisotnosti čednega gospoda Brandt iz centralne banke. vedenje gospoda Mundyja je nič manj kot zgledno. imel je vse možnosti, da razglasi stečaj; k temu ga je celo spodbudil. vendar je gospod Mundi vztrajal. zdaj lahko odplača vse, vključno z banko. to je zelo razveseljivo, pravi gospod Frinck. celo zaračunavali bodo realne obresti, ki so v takšnih okoliščinah še redkejše."
»Res ste tako rekli. Ampak pred dokončno ste gotovo sklenili vsaj kakšno bolj kratkoročno pogodbo. Niti v najbolj dobrohotnih fundacijah se ne bi od takšne vsote ločili brez enega samega dokumenta.«,"""Da, ste, toda preden ste ga dokončali, ste morali skleniti vsaj kratkoročno pogodbo in celo v najbolj dobrohotnih temeljih se od takšne vsote ne bi ločili brez enega samega dokumenta."""
»Pa so se.«,"""Res je."""
»In avto?«,"Kaj pa avto? """
"»To pa ne bo držalo, Stefan. Sam sem za to izvedel šele pred desetimi dnevi.«","""to ne bo res, Stefan, za to sem izvedela šele pred desetimi dnevi."""
"»Seveda, malo so se razgledali naokoli. Šel sem mimo, pa sem skozi okno opazil nekaj postav pa nekaj baterij, in sem si rekel, aha, Herr Ted je že nazaj. Ali pa to ni Herr Ted in so v hiši vlomilci. Prestar sem, da bi se bal umreti, zato sem odšel k vratom in glasno potrkal. Odprl mi je ljubezniv mladenič, s prijetnim nasmeškom, v kombinezonu. Z baterijo v desnici. Zadaj sem videl še nekaj mladih moških, mogoče tudi eno žensko. Ženske so danes že vsepovsod. 'Naj vas nikar ne skrbi,' mi je rekel. 'Prijazni ljudje smo.' 'Si ogledujete hišo za Herr Teda?' sem vprašal. 'Ne, ne,' je rekel, 'za hipotekarno družbo. Če mu bo dala kredit, se bo Herr Ted lahko vrnil.'«","""Seveda so se malo razgledali naokoli. šel sem mimo, vendar sem skozi okno opazil nekaj številk in nekaj baterij in rekel:"" Aha, Herr Ted se je vrnil. Ali ni Herr Ted in v hiši so vlomilci. prestar sem, da bi se bal umreti, zato sem šel k vratom in glasno potrkal. Vrata sem odprl s prijaznim mladeničem, z lepim nasmehom, v kombinezonu. Z baterijo v desni roki sem videl nekaj mladih moških zadaj, morda celo eno žensko. Ženske so danes vsepovsod. 'ne skrbi,' rekel mi je. 'prijazni ljudje iščejo Teda Herra v hiši.' Ne, vprašal sem Teda, če bi dal hipoteko. rekel je, da mu ne bi dal posojila."
"»Zjutraj. Ob osmih. Deževalo je. S kolesom sem se peljal k Frau Liebknect, da ji malo uredim vrt. Popoldne, ko sem se peljal nazaj, so bili še vedno tu. Neznansko sem radoveden, kar vprašajte Elli. Nepoboljšljiv sem. 'Kako to, da ste še vedno tukaj?' sem jih vprašal. 'Velika hiša je,' so rekli. 'Veliko denarja bo stala. Veliko denarja pa zahteva veliko časa.'«","""zjutraj. Ob osmih je deževalo. s kolesom sem se odpeljal do Frau Liebknect, da bi ji pomagal urediti vrt. popoldne, ko sem se odpeljal nazaj, so bili še vedno tukaj. zelo sem radoveden, samo vprašaj Ello. nisem uresničljiv."" Kako to, da si še vedno tukaj? ""vprašal sem jih."" To je velika hiša "", so rekli. ""stala bo veliko denarja in to traja veliko časa."""
