original,paraphrase
Vipavski župan je pripravil pogovor o gospodarskih razmerah v Agroindu Vipava 1894 - Agonijo naj bi končali z dejanjem dobre volje kmetov,Vipavski župan je v Agroindu Vipava 1894 pripravil pogovor o gospodarskih razmerah - agonijo naj bi končali z dejanjem dobre volje kmetov
"Govorice o takšnih, pravzaprav korenitih spremembah, ki da jih utegne zasavski zakon doživeti še pred drugo obravnavo, so v Zasavju krožile že lep čas, a jih uradno ni želel nihče pristojnih niti potrditi niti ovreči. Po včerajšnjem srečanju županov šestih občin, ki naj bi jih zajel zasavski zakon, z ministrico za gospodarske dejavnosti dr. Teo Petrin, pa so se izkazale za resnične. Čeprav vodstvo trboveljske termoelektrarne do najnovejšega predloga še ni oblikovalo uradnega stališča, je direktor razvojno-investicijskega sektorja v TET Branko Lukšič zadevo vseeno komentiral. Dejal je: »Naše dosedanje usmeritve oziroma vsa izdelana dokumentacija so seveda povsem drugačne kot ta predlog. Naše usmeritve so predvidele revitalizacijo termoenergetskega bloka in obratovanje do leta 2015. Do seje vlade, do prihodnjega tedna, bomo ocenili, kaj zadnje načrtovane spremembe zakona pomenijo za nas, že zdaj pa lahko opozorim na ekološki vidik, saj izpusti termoelektrarna v ozračje na leto od 25.000 do 27.000 ton žveplovega dioksida. Če bi zgradili odžveplovalno napravo, bi te emisije znašale le še okrog tisoč ton na leto.« Lukšič se povrh vsega še vprašuje, koliko bo lahko za Evropo oziroma za evropski trg zanimiva elektrika, ki bo poleg tega, da bo relativno draga, prišla še iz ekološko negotovega objekta. To dvoje pa po njegovem za seboj potegne še tretji, poslovni vidik.","Govorice o takšnih, pravzaprav radikalnih spremembah, ki bi jih Zakon o Zasavju lahko doživel pred drugo obravnavo, so v Zasavju krožile že dolgo, vendar jih nihče od pristojnih oblasti ni želel potrditi ali ovreči. Po včerajšnjem srečanju županov šestih občin, ki naj bi jih urejal Zasavski zakon z ministrico za gospodarske dejavnosti dr. Tejo Petrin, so se izkazale za resnične. Čeprav vodstvo trboveljske termoelektrarne še ni oblikovalo uradnega stališča o zadnjem predlogu, je Branko Lukšič, direktor razvojno-investicijskega sektorja TET, vseeno komentiral zadevo. Povedal je: ""Naša dosedanja politika ali vsa dokumentacija, ki je bila izdelana, je popolnoma drugačna od tega predloga. Naše smernice so predvidele revitalizacijo termoelektrarne in njeno obratovanje do leta 2015. Do sestanka vlade, do naslednjega tedna, bomo ocenili, kaj za nas pomenijo zadnje načrtovane spremembe zakona, vendar lahko že opozorim na ekološki vidik, saj se toplotna energija, ki se sprošča v ozračje letno od 25.000 do 27.000 ton žveplovega dioksida. Če bi bila zgrajena elektrarna na žveplo, bi te emisije znašale le okoli tisoč ton na leto. ""Poleg tega se Lukšič sprašuje, koliko električne energije bo zanimivo za Evropo ali za evropski trg, ki ne bo samo iz relativno nezanesljivega objekta. Meni, da tretji, poslovni vidik, črpa iz teh dveh."
"Ne glede na to, da se po tem letu za ekologijo tudi v Sloveniji napoveduje nova zakonodaja, pa naj bi po najnovejšem predlogu drugi termoenergetski blok v Trbovljah brez čistilne naprave ter s tem prek vseh dovoljenih emisij obratoval še vse do leta 2008 ...","Ne glede na to, da bo po letošnjem letu v Sloveniji objavljena nova zakonodaja na področju ekologije, bo po zadnjem predlogu druga termoelektrarna v Trbovljah brez čistilne naprave in s tem skozi vse dovoljene emisije obratovala še do leta 2008..."
"Sicer pa so člani predsedstva včeraj med drugim obravnavali vprašanja, povezana s financiranjem občin. Najprej uresničevanje zakona o izvrševanju proračuna, ki je bil predmet razprav, zlasti zaradi rešitev, katerih posledica bi bilo zmanjševanje lastnih virov mnogih slovenskih občin. Ta težnja je v nasprotju s trendi v EU, kjer krepijo vlogo občine tudi tako, da jim zagotavljajo ustrezna sredstva. Težko je govoriti o manjši odvisnosti občin od države, če ta zateguje okvire, znotraj katerih se občine lahko financirajo. Po mnenju članic združenja (vanj je povezanih 105 občin z več kot polovico prebivalcev Slovenije) je treba ohraniti obseg lastnih virov.","V prvi vrsti je bilo izvajanje zakona o izvrševanju proračuna, ki je bil predmet razprav, predvsem posledica rešitev, ki bi imele za posledico zmanjšanje lastnih sredstev številnih slovenskih občin. Ta tendenca je v nasprotju s trendi v EU, kjer krepijo vlogo občin tudi z zagotavljanjem ustreznih sredstev. Težko je govoriti o manjši odvisnosti občin od države, če se z njo zožijo okviri, znotraj katerih se občine lahko financirajo. Po mnenju članov združenja (z njim je povezanih 105 občin z več kot polovico prebivalstva Slovenije) je količina"
"Železniki - Kulturno društvo Rov iz Železnikov je po dolgotrajnih prizadevanjih najelo prostore nad trgovino kmetijske zadruge, v katerih bo deloval mladinski kulturni center. Danes ob 16. uri bo otvoritev prostorov z videoprojekcijo delovanja društva ter krajšim kulturnim in umetniškim programom. Ves čas bo na ogled fotografska razstava, prostorska inštalacija artifaktov polpretekle zapuščine prostora in zbirka izdaj društvene glasbene založbe Podpajsha. Ma. R.","Železniki - Kulturno društvo Rov iz Železnikov je po dolgotrajnih prizadevanjih nad trgovino kmetijske zadruge, v kateri bo deloval mladinski kulturni center, oddalo v najem prostore, danes ob 16. uri pa bo odprtje prostorov z video projekcijo delovanja društva in kratkim kulturno-umetniškim programom."
- Zakon o zagotovitvi sredstev za odpravo posledic naravne ujme v zimi 1996 -1997 (predlog občine Vipava za dodelitev sredstev kmetom zaradi pozebe) - poslanec Tomažič glasoval proti;,- Zakon o zagotovitvi sredstev za odpravo posledic naravnih nesreč v zimskem obdobju 1996 - 1997 (predlog Občine Vipava za dodelitev sredstev kmetom zaradi pozebe) -
