original,paraphrase
"In ker je njegovo občinstvo pogosto prelepo, da bi bilo slišalo za Nevilla Chamberlaina ali da bi vedelo, katerega hudiča ima v mislih, čistokrvni Anglež velikodušno postreže z lastno različico sramotnega münchenskega sporazuma iz leta 1938 za začetnike, vključno s pripombo, da je bil celo naši ljubljeni britanski monarhiji, da naše aristokracije in stranke torijcev tu na zemlji niti ne omenja, ljubši vsakršen sporazum s Hitlerjem kakor vojna.","In ker je njegovo občinstvo je pogosto preveč dobro slišati ime Neville Chamberlain ali vedo, kateri hudič ima v mislih, Čist Anglež velikodušno služi up svojo različico zloglasni Münchenski sporazum 1938 za začetnike, vključno z opombo, da celo naša ljubljena britanska monarhija, niti omeniti našo aristokracijo in naše Tory stranka tukaj na zemlji, raje kateri koli sporazum s Hitlerjem v vojno."
Poleg tega je tako rekoč na begu.,In tako rekoč je na begu.
"Egon, njegov poslovni partner in soustanovitelj njune Akademije za profesionalno angleščino, ki je komajda životarila, je lepega dne pobegnil z vsem skupnim premoženjem. Mundyju ni preostalo drugega, ko da se je sredi noči odpeljal iz Heidelberga, z vsem, kar je lahko spravil v starega volkswagna, in s 704 evri, ki jih je malomarni Egon pozabil ukrasti iz blagajne.","Egon, njegov poslovni partner in soustanovitelj njihove Academy of Professional English, ki je komaj preživel, pobegnil en dan z vso skupno lastnino, in Mundy ni imel druge izbire, kot da vozi iz Heidelberga sredi noči, z vsem, kar je lahko fit v stari Volkswagen, in 704 evrov, ki malomarni Egon pozabil ukrasti iz registra."
"Naglo jo odvede v drugo kavarno. Po licih ji polzijo solze, a se jih očitno komaj zaveda. Dolgo ji prigovarja, naj mu pove kaj o sebi, in nazadnje mu res začne pripovedovati. Brez velike vneme, a tudi brez vsakršne zadrege. Je vaško dekle z ravnic Adane, najstarejša hči v kmečki družini, mu pove v zatikajočem se bavarskem dialektu. Njen oče jo je obljubil v zakon sinu sosednjega kmeta. Fant mu je bil predstavljen kot računalniški genij, ki v Nemčiji služi lepe denarce. Ko jih je prišel obiskat v Adano, so njeni pripravili tradicionalno poročno slavje, napovedali so združitev obeh kmetij, Zara pa je z možem odpotovala v München. Tam je ugotovila, da ni računalniški genij, ampak navaden kriminalec. Star je bil štiriindvajset let, ona jih je imela sedemnajst in bila je noseča z njim.","Njene solze tečejo po licih, ampak ona je očitno komaj zaveda njih. Ona jo prosi za dolgo časa, da mu povem nekaj o sebi, in končno je res začne, da mu povem. Brez veliko navdušenja, ampak tudi brez zadrege. Vaško dekle iz ravnic Adana, najstarejša hči v kmečki družini, mu pove, v zaljubljen bavarski narečju. Njen oče ji je obljubil v zakonu s sinom sosednjega kmeta. Fant je bil predstavljen mu kot računalniški genij, ki služi v Nemčiji, in ko je prišel v Adana so pripravili tradicionalno lepo poročno slavje, so napovedali združitev dveh kmetij, in Zara potoval v München s svojim možem. Tam je ugotovila, da ni bila običajna računalniška genij, vendar je bila stara dvajset in štiri leta in je bila noseča z njim."
"»Formalnosti niso pomembne,« ga pomiri mladi imam. »Odgovornost je vse. Bodi odgovoren in Bog te bo nagradil.«","""formalnosti niso pomembne,"" vam zagotavljam, mladenič. ""odgovornost je vse, bodite odgovorni in Bog vas bo nagradil."""
"»Angleško govoreči torej k meni, prosim, hvala lepa. Pravzaprav bi moral reči angleški poslušalci. Čeprav si ob tejle uri dneva zaželim, da bi vi govorili namesto mene. Ha! No, saj ni čisto tako« na tem mestu namenoma stiša glas in prisili poslušalce, da se umirijo in mu prisluhnejo »zagotavljam vam, da mi še ne pojemajo moči. Fotografiranje je seveda dovoljeno, dame in gospodje, a ne z videokamerami, lepo prosim tudi vi, gospod, hvala lepa ne sprašujte me, zakaj, ampak moji gospodarji mi zagotavljajo, da bi nas že en sam bežni posnetek z videokamero spravil na sodišče za intelektualno lastnino. Običajna kazen je javna usmrtitev z obešenjem.« Nihče se ne zasmeje, toda smeha tudi ne pričakuje od občinstva, ki je zadnje štiri ure presedelo na avtobusu, nato pa še uro stalo v vrsti na pekočem soncu. »Stopite bliže k meni, prosim, gospe in gospodje, še malo bliže, če ste tako ljubeznivi. Tu pred mano je še polno prostora, gospe« skupini resnih švedskih učiteljic »me lahko slišite, mladi gospodje?« leglu koščenih najstnikov izza nevidne saške meje, ki so pomotoma zatavali v napačno stajo, a sklenili, da ostanejo in dobijo brezplačno uro angleščine »Lahko? Zelo dobro. In vi, gospod, me lahko vidite?« malemu drobnemu Kitajcu »Lahko. Dobro. Še majhna osebna prošnja, če dovolite, gospe in gospodje. Handiji, kakor jim rečemo tu v Nemčiji, sicer znani tudi kot mobilni telefoni bi bili tako ljubeznivi in jih izklopili? Ste jih? Potem pa naj, prosim, zadnji zapre vrata za seboj, vi, gospod, ja, in lahko začnemo. Hvala lepa.«","""angleško govoreči ljudje prihajajo k meni, prosim, najlepša hvala. pravzaprav, bi moral reči angleški poslušalci. Čeprav si ob tej uri dneva želim, da bi govorili zame. Ha? No, to ni ravno to"" na tem mestu je namerno utišal svoj glas in prisilil svoje poslušalce, da se umirijo in ga poslušajo ""Lahko vam zagotovim, da še ne izgubljam moči. Fotografija je seveda dovoljena, dame in gospodje, vendar ne z video kamerami, prosim, ne sprašujte me zakaj, gospod, hvala, ne sprašujte me, zakaj, ampak moji mojstri mi zagotavljajo, da nas bo samo en hiter video iz video kamere postavil na sodišče za intelektualno lastnino. Običajna kazen je javno usmrtitev z obešanjem. ""Nihče se ne smeji, vendar nihče ne pričakuje smeha od občinstva, ki je zadnje štiri ure sedel na avtobusu in nato stal eno uro v vrsti na žgočem soncu."" Prosim, pridite bliže k meni, dame in gospodje, če ste tako prijazni. Tukaj pred menoj je še vedno dovolj prostora za damo. ""skupina resnih švedskih učiteljev"" Lahko me slišite, mladi gospodje ""suhljatih najstnikov izza nevidne saksonske meje, ki so po nesreči zašli v zelo dobro. In vi, gospod, me lahko vidite? ""v majhni kitajski"" Lahko. Dobro. Majhna osebna zahteva, če prosim, gospe in gospodje. Handi, kot jih imenujemo tukaj v Nemčiji, drugače znani tudi kot mobilni telefoni, bi bili tako prijazni in jih izklopili Ali ste potem, prosim, zaprite zadnja vrata za vami, vi, gospod, da, in lahko začnemo. Najlepša hvala. """
"Poleg tega je Mundy iz nuje in po izurjenosti previden človek. V Linderhofu ne naredi enega samega koraka, ne da bi bil prej preveril, kaj je pred in kaj za njim, ne da bi se prepričal, kdo mu prihaja naproti, bodisi kdo iz prejšnjih življenj bodisi kak nebodigatreba iz sedanjega, kak tat, vandal, žepar, upnik, vročevalec sodnih pozivov iz Heidelberga, senilen turist, ki ga je zadela srčna kap, otrok, ki bruha po neprecenljivi preprogi, dama s kužkom, skritim v ročni torbi, in nazadnje kakor odločno opozarja uprava samomorilsko razpoloženi terorist. Iz tega imenitnega izbora seveda ne smemo izključiti olajšanja, kakršno obide celo moškega, ki živi v tako zadovoljujoči zvezi kakor Mundy, kadar zagleda lepo oblikovano dekle, katere značilnosti zaslužijo takojšnje in neprikrito občudovanje.","Ne naredi niti enega koraka v Linderhofu, ne da bi najprej preveril, kaj je pred njim in kaj je za njim, ne da bi bil prepričan, kdo mu prihaja, ali nekdo iz prejšnjih življenj ali kakšen lopov iz sedanjosti, tat, vandal, žepar, upnik, pozivnik-nosilec iz Heidelberga, senilni turist, ki ga udari srčni napad, otrok, ki bruha po neprecenljivi dami, s kužkom, skrit v torbici in končno, kot uprava močno opozarja, samomorilski terorist. Seveda, iz tega finega izbora ne smemo izključiti niti človeka, ki živi v tako zadovoljivi zvezi kot Mundy dekle, ko vidi lepe in nepričakovane značilnosti, ki si zaslužijo takojšnje občudovanje."
"»Dogovorjeno!« reče Mundy, se ljubeznivo nasmehne in zganjeni listič v dlani urno pospravi v žep suknjiča.","""Dogovor "", pravi Mundy, se prijazno nasmehne in da papir v žep suknjiča."
"Pobrska po žepu suknjiča in izvleče zmečkan zavitek vžigalic iz Zarine kebabnice. Odtrga eno, jo prižge in podrži najprej pod enim in nato še pod drugim vogalom papirja, dokler sporočilo ni tanka plast pepela. Spusti ga na kamnita tla in ga s peto zmečka v črn prah: nujna previdnost. Pogleda na zapestno uro in računa. Še ura in dvajset minut. Nima smisla, da bi jo zdaj poklical. Komaj je začela streči. Njen šef ponori, če osebje v času največjega prometa dobiva telefonske klice. Mustafa je gotovo v Dininem stanovanju s Kemalom. Mustafa in Kemal sta najboljša prijatelja, glavni zvezdi westendovske vseturške državne lige v kriketu; njen predsednik je gospod Edward Mundy. Dina je Zarina sestrična in dobra prijateljica. Izvleče stari mobilni telefon, poišče njeno številko in jo pokliče.","On RIPE ena, ga vklopi in ga drži pod eno in nato pod drugim kotom papirja, dokler sporočilo je tanka plast pepela. On ga pade na tla in ga zdrobiti v črni prah nujna previdnost. Ona gleda na njeno ročno uro in račune. Še ena ura in dvajset minut. To nima smisla, da jo pokličete zdaj. Začela je služiti. Njen šef gre nor, če osebje dobi telefonske klice v času največjega prometa. Mustafa je prepričan, da je v Dina stanovanju s Kemal. Mustafa in Kemal so najboljši, glavne zvezde West All-Tendish League predsednik v celici Edward Mundish; je njen bratranec Edward Mundy kliče."
"»Dober večer, Mustafa! Kako si kaj?« počasi, poudarjeno vpraša Mundy. Govorita angleščino, kakršno uči dečka.","""Dober večer, Mustafa, kako si?"" vpraša Mundy počasi, s poudarkom: govorijo angleško, kar uči fanta."
"Med zrenjem v klobuk se mu pred očmi nenadoma odvije ves prizor. Tlakovana ozka ulica in majhna delavnica nad pekarno. Razbito steklo in kri na kamnitem tlaku, ko Josepha Steinmatzkyja, njegovo ženo in njune številne sinove odvlečejo med bučnim spodbujanjem dunajskih pregovorno nedolžnih očividcev.","Tlakovana ozka ulica in majhna delavnica nad pekarno, razbito steklo in kri na kamnitem pločniku, kot so Joseph Steinmatzky, njegova žena, in njuni številni sinovi, so odvlečeni med burnim opozarjanjem dunajskih pregovorno nedolžnih očividcev."
"S Volkswagnovim hroščem odropota čez grbino med pozlačenimi vrati v grad norega Ludvika in zavije na cesto proti Murnauu. Avto, podobno kakor njegov lastnik, ni rosno mlad. Motor sopiha, utrujeni brisalci so v vetrobransko steklo izpraskali polmeseca. Doma izdelana nalepka zadaj je Mundyjeva domislica: v nemščini je napisal Voznik tega avtomobila nima več nikakršnih ozemeljskih zahtev v Arabiji. Brez nezgode prevozi dve manjši križišči in na parkirišču, kakor mu je bilo naročeno, ustavi za modrim audijem z münchensko registracijo; za krmilom zgrbljeno sedi Saša, pokrit s črno baretko.","Avto, tako kot njegov lastnik, sploh ni mlad. Avto, tako kot njegov lastnik, se ustavi za modrim Audijem z registracijo v Münchnu za krmilo z zloženim sedežem Sasha, zajeto v črno baretko. Voznik tega avtomobila nima več teritorialnih zahtev v Arabiji. Avto, tako kot njegov lastnik, poteka skozi dve majhni križišči brez nesreče in se ustavi za parkiriščem, kot so mu povedali, za modrim audijem z Münchnom; registracija za krmilo z nagnjenim sedežem Sasha, pokrita s črno baretko."
"Grossadmiral z zastavami ovešenega parnika po megafonu poziva veseljake, naj pozabijo na skrbi in se pri priči prijavijo za romantično križarjenje. Nad jezerom se razpoči petarda. Slepeče zvezdice v slapu padajo v vodo. Se približujejo ali oddaljujejo? Vprašajte Busha ali Blaira, naša velika vojna voditelja, čeprav ne prvi ne drugi še ni doživel v gnevu izstreljenega naboja.","Z zastavami dobro obrabljenega parnika na megafonu, Grossadmiral poziva vesele tiste, da pozabijo na svoje skrbi in se takoj prijavijo za romantično križarjenje. Petarda poči nad jezerom. Slepe zvezde padajo v vodo. Ali se približujejo ali oddaljujejo Vprašajte Busha ali Blaira, našega velikega vojnega voditelja, čeprav nobeden od njih še ni videl strela v množici."
"Prisluhne, a razen trušča s sejmišča ne sliši ničesar. Vstopi in za seboj zapre vrata. V polmraku zagleda Saša: ukrivljeno stoji v položaju mirno, z nakupovalno vrečko pri nogah. Roki drži iztegnjeni ob telesu, kolikor jih pač more, palca štrlita naprej v najboljši maniri funkcionarja komunistične partije na paradi. Toda schillerjanski obraz, ognjevite oči, napeta, naprej nagnjena drža kljub migotajočem mraku še nikdar niso bili tako izraziti, živi in čuječni.","On posluša, vendar sliši nič, ampak hrup iz sejmišča. On vstopi in zapre vrata za njim. V pol - temno vidi Sasha: stoji ukrivljen mirno, z nakupovalno vrečko na noge. Njegove roke so iztegnjene na njegovo telo, kolikor je mogoče. Palci štrlijo naprej v najboljši način uradnika Komunistične partije v paradi. Toda schilleran obraz, ognjene oči, naprej nagnjena drža, kljub utripajoče somrak še nikoli ni bila tako izrazita, živ in pozoren."
"Še vedno isti prikriti saški naglas, prešine Mundyja. Isti pedantni, kakor britev ostri glas, vsaj tri stopnje premočan zanj. Ista neposredna kritičnost.","Še vedno isti prikriti Saxon naglas, on skomigne Mundy, enako pedantno, britev oster glas, vsaj tri stopnje premočan za njega."
"So pa še drugačni večeri k sreči jih ni prav veliko , ko Major s še bolj namrščenim obrazom kakor ponavadi stopi k pisalni mizi v kotu sobe, jo odklene s ključem na verižici in iz nje ceremonialno vzame star, v rdeče usnje vezan izvod Izbranih odlomkov iz del Rudyarda Kiplinga. Iz obtolčenega, zdrsanega kovinskega etuija vzame očala, v vdolbino v naslonjalu stola iz trstovca postavi kozarec z viskijem in začne monotono prebirati pripoved o dečku iz džungle Mowgliju in še enem dečku po imenu Kim, ki je postal vohun v službi njegove kraljice in cesarice; žal izbrani odlomki ne razkrijejo, kaj se je z njim zgodilo, ko je postal vohun: mu je uspelo ali so ga ujeli? Pred koncem Major tudi po več ur s slovesnim glasom prebira odlomke in srka pijačo, kakor da bi sam samcat izvajal sveto obhajilo, dokler končno ne omahne v sen. Aja tiho prihiti iz teme hodnika, kjer je ves čas sedela, prime Mundyja za roko in ga odvede v posteljo. Kiplingova antologija, Major zaupa sinu, je edini preživeli primerek nekdanje bogate, izbrane knjižnice njegove matere.","Vendar pa ni veliko drugih večerov,;, ko Major pride k mizi v kotu sobe s še bolj namrščenim obrazom kot običajno, ga odklene s ključem na ogrlici in iz njega vzame staro, rdečo usnjeno vezano kopijo odlomkov iz del Rudyard Kipling. On vzame očala iz potolčenega, drsnega kovinskega ohišja, postavi kozarec z viskijem v vdolbino na zadnjem delu stola iz trstja in začne brati fragmente zgodbe o dečku iz džungle z imenom Mowgli in še en fant z imenom Kim, ki je postal vohun v službi svoje kraljice in cesarice, na žalost izbrani ne razkrivajo, kaj se mu je zgodilo, ko je postal vohun, Za nekaj ur pred koncem Major bere odlomke s svojimi sanjami: če je bil njegov glas svečan in končno pije v sveto obhajilo. Aha tiho prihaja iz teme na hodniku, kjer je ves čas sedela, vzela Mundyja za roko in ga odpeljala v posteljo. Kiplingova antologija, Major zaupa svojemu sinu, je edini preživeli primerek nekdaj bogate in izvrstne knjižnice njegove matere."
"V internatu, kjer konča po zaslugi zapuščine daljne sorodnice in štipendije za sinove vojaških častnikov, je Mundy najprej zbegan in nato zgrožen. Besede, ki mu jih ob slovesu izreče Major, naj so še tako dobrohotno mišljene, ga ne pripravijo na novo življenje. »Nikdar ne pozabi, da te mati ves čas opazuje, fant moj, in če se kak poba češe v javnosti, jo uvcri čim dlje, kolikor te nesejo noge,« ga posvari s hripavim glasom in nerodno objame. Medtem ko si Mundy na vlaku krčevito poskuša zapomniti, da ga mama nenehno opazuje, se zaman ozira za otroškimi berači, ki stegujejo ročice k oknom, na postajah ni celih vrst trupel, zavitih v mrliški prt, izpod katerega štrlijo edinole stopala, niti fantov, ki bi se česali v javnosti. Namesto gnojsko rjave pokrajine in modrih gorskih vrhov vidi le premočena polja in skrivnostne napise, ki mu pripovedujejo, da je Dobrodošel v Močni državi.","Na internat, kjer se konča zaradi zapuščine oddaljenega sorodnika in štipendije za sinove vojaških častnikov, Mundy je sprva zmeden in nato zgrožen. Besede, ki mu jih Major pove, ko se poslavlja, ne glede na to, kako prijazno so mišljene, ga ne pripravi na novo življenje. ""Nikoli ne pozabite, da vas mati ves čas opazuje, moj fant, in če se fant v javnosti oglaša, zveni tako dolgo, kot si lahko,"" ga opozori s hripavim glasom in ga nerodno objame. Medtem ko se Mundy na vlaku poskuša spomniti, da ga mati opazuje, nenehno išče otroke, ki segajo do oken, na postajah ni vrst mrtvih teles, v katerih država izstopa, kjer so mrtve noge prekrite samo z rjavimi in modrimi vrhovi v državi."
"A čeprav zatiranje v Mundyju vzbuja prezir in sovraštvo do ječarjev, ne more preprečiti lastne sprejemljivosti v njihovih očeh. Mundyjev pravi sovražnik je njegova dobrosrčnost, njegova neugasljiva želja po pripadanju. Morda samo tisti, ki niso imeli matere, lahko razumejo, kolikšno praznino mora zapolniti. Sprememba uradnega šolskega odnosa do njega je domiselna in zahrbtna. Dosledno so prezrta vsa njegova dejanja nepokorščine. Čeprav kadi na najbolj nevarnih krajih, ga nihče nikdar ne zasači ali zavoha. Na mašo v kapeli pride okajen, naravnost iz bližnje gostilne, kjer je pri zadnjih vratih zvrnil vrček piva. A namesto da bi ga prebičali, ga povzdignejo v študentskega nadzornika in mu namignejo, da se mu nasmiha položaj voditelja nadzornikov. Pa to še ni vse. Kljub očitni nespretnosti se znajde v ragbijskem moštvu, pri kriketu pa ga kot najboljšega metalca uvrstijo med prvih enajst igralcev in iz njega naredijo neprepričljivega junaka. Čez noč so pozabljeni vsi njegovi poganski rituali in prevratniške težnje. V grozljivi uprizoritvi Slehernika mu dodelijo glavno vlogo. Šolo zapusti ovenčan z nehoteno slavo in, po zaslugi doktorja Mandelbauma, s štipendijo za študij modernih jezikov na Oxfordu.","Toda kljub temu, da zatiranje v Mundy povzroča zaničevanje in sovraštvo ječarjev, ne more preprečiti njihovega lastnega sprejemanja v njihovih očeh. Mundyjev pravi sovražnik je njegova dobrosrčnost, njegova nepotešljiva želja po pripadnosti. Morda le tisti, ki niso imeli matere, lahko razumejo, koliko praznine mora zapolniti. Sprememba v odnosu uradne šole do njega je domiselna in zahrbtna. Vsa njegova dejanja neposlušnosti so dosledno prezrta. Čeprav kadi na najbolj nevarnih mestih, ga nihče nikoli ne ujame ali zavoha. On pride do mase v kapeli, pijan, naravnost iz bližnje gostilne, kjer je vrgel vrček piva na zadnja vrata. Toda namesto da bi bi bičali, je bil povišan v študentskega nadzornika in namignil, da je vodja nadzornikov. Ampak to ni vse. Kljub svoji navidezni nerodnosti, se znajde na rugby team, in v kriketu je uvršča med top enajst igralcev, kot najboljši metalec, zaradi česar mu je neprepričljivo junak. Čez noč, vsi njegovi poganski rituali in subverzivnih tendenc so pozabljeni. V grozljivo proizvodnjo Everyman, on je glede na glavno vlogo. Šolo zapusti z neprostovoljno slavo in po zaslugi dr. Mandelbauma tudi s štipendijo za študij sodobnih jezikov na Oxfordu."
»Dragi moj fant.«,"""Moj dragi fant."""
"»Kljub temu, gospod.«","""Kljub temu, gospod."""
"»Mislim, da bodo Huni spet udarili po nas, kaj praviš? Dvajset let je že od zadnjega spopada. In še dvajset let od tistega pred njim. Pripravljeni so na novega, verjemi mi.«","""mislim, da nas bodo Huni spet napadli, mislite, da je minilo 20 let od zadnjega boja in 20 let od tistega pred njim, pripravljeni so na naslednjega, verjemite mi."""
"Obledeli pergamenti podeljujejo Arthurju Henryju Georgeu Mundyju čin in položaj podporočnika, poročnika, kapetana v pehotnem polku, v manjši enoti in nato še manjši.","Beaded Pergament nagrade Arthur Henry George Mundy čin in položaj drugega poročnika, kapetan pehotnega polka, manjših in nato še manjših."
"Pozornost usmeri na nižjo stopnico, išče visoko dekle v uniformi pestunje, z zaprtimi očmi. Zlahka jo najde. Vedra, zelo visoka punca je, z gostimi črnimi kodri; njene irske oči so priprte natanko tako, kakor piše na fotografiji. Če bi se Mundy na skrivaj preoblekel v pestunjo, si na glavo poveznil črno lasuljo in s priprtimi očmi pogledal v slepeče indijsko sonce, bi bil čisto tak kakor ona, kajti na fotografiji je stara prav toliko, kolikor je zdaj star sam, in najbrž tudi enako visoka. In prav tako neumno se nasmiha kakor jaz, ko jo gledam skozi tole povečevalno steklo, kar je verjetno najbliže, kar jo bom kdaj videl.","Bucky, zelo visoka punca, z debelimi črnimi kodri; njene irske oči so zaprte točno tako, kot piše na strani. Če Mundy skrivaj spremenila v nursemair, si dal črno lasuljo na glavi in zaprl oči za oslepitev indijskega sonca, bi bil prav tako kot ona, ker na fotografiji je tako stara, kot je zdaj, in verjetno enako višino. In ona se nasmehne prav tako neumno, kot jaz, ko sem pogled na njo skozi to povečevalno steklo, ki je verjetno najbližja stvar, bom kdaj videli."
Temu pravimo ljubezen.,Temu se reče ljubezen.
"Ilsini starši živijo v Hendonu, v dvojčku z zeleno streho in plastičnimi palčki ob vrtnem ribniku. Njen oče je marksistični kirurg s širokim slovanskim čelom in razmršenimi lasmi, mati pa pacifistična psihoterapevtka, privrženka Rudolfa Steinerja. Mundy še ni srečal tako inteligentnega, širokosrčnega para. Opogumljen z njunim zgledom se nekega jutra prebudi trdno odločen, da bo njuni hčeri ponudil zakon. Zamisel ga popolnoma prevzame. Ilse, na smrt zdolgočasena zaradi mlačnih britanskih protestov, že nekaj časa razmišlja o selitvi v katero izmed univerzitetnih naselij, v katerih študentje vsako stvar razčistijo do konca, denimo v Parizu, Berkeleyju ali Milanu. Po dolgem, globokem tuhtanju izbere Svobodno univerzo v Berlinu, ki je življenjsko pomembna za novo svetovno ureditev; Mundy ji obljubi, da bo študij za eno leto prekinil in šel z njo.","Ilsini starši živijo v Hendonu, dvojčku z zeleno streho in plastičnimi palčkami ob vrtnem ribniku. Njen oče je marksistični kirurg s širokim slovanskim čelom in nasršenimi lasmi; njena mati je pacifistični psihoterapevt, privrženec Rudolfa Steinerja. Mundy še nikoli ni srečal tako inteligentnega, širokosrčnega para. Zgleduje se po njihovem primeru, se nekega jutra zbudi odločen, da bo svoji hčerki ponudil poroko. Ideja je popolnoma prevzeta. Ilse, ki se na smrt dolgočasi zaradi mlačnih britanskih protestov, že nekaj časa razmišlja, da bi se preselila v eno od univerzitetnih naselij, v kateri študentje vse uredijo do konca, kot so Pariz, Berkeley ali Milano. Po dolgem, globoko navzdol, izbere Univerzo za svobodno življenje v Berlinu, v kateri je njen razred prekinil študij za novo leto; obljublja ji, da bo za eno leto prekinil študij.;"
"In kaj je bolj naravnega, ji reče, kakor če greva tja kot mož in žena?","In kaj je bolj naravno, pravi,, kot da gremo tja kot mož in žena?"
"Dan pozneje Mundy dočaka odgovor. Debelušni madžarski angel, ki ima na sebi le nogavice, stoji v edinem kotu svoje puščavniške sobice, od koder ga ni mogoče videti z dvorišča. O njenem pacifistično-anarhistično-humanistično-radikalnem človekoljubju ni več sledu. Roki ima stisnjeni v pest, po izpranem obrazu ji vrejo solze.","Dan kasneje Mundy prejme odgovor. Navadni madžarski angel, ki ne nosi nič drugega kot nogavice, stoji v edinem kotu svojega puščavnika, od koder ga z dvorišča ni mogoče videti. O njeni pacifistično-anarhistično-humanistično-radikalni filantropiji ni sledu."
"»Kateri Saša, kje naj ga najdem, za božjo voljo?« zavpije skozi okno na peron waterloojske postaje, medtem ko si Ilse, ki jo muči madžarsko kesanje, že stotič premisli in sklene, da se bo odpeljala z njim, ko bi bila le vzela s seboj potni list.","""kdo Sasha, kje ga najti, za božjo voljo?"" zavpije skozi okno na peronu postaje Waterloo, medtem ko Ilse, ki jo muči madžarsko obžalovanje, že stotič spremeni svoj um in se odloči vzleteti z njim, če bi le s seboj vzela potni list."
