original,paraphrase
"Ko sem se spet oblekel, sem pogledal na uro – imel sem še dvajset minut. Zavlekel sem se torej v kabino, se zaklenil in se usedel na školjko.","Ko sem se spet oblekel, sem pogledal na uro - ostalo mi je še 20 minut - zato sem se odvlekel v kabino, se zaklenil vanjo in sedel na stranišče."
"Precej časa je že, kar sem zadnjič nasedel mikom, ki jih obeta moderna telefonska industrija. Bilo je leta 1996, ko sta se nama rodila dvojčka in je žena rekla, da bi bilo dobro, če bi imela mobilni telefon, tako da bi bila, če bi prišlo do kakih nepredvidljivosti, na ta način lahko v stiku tudi, kadar bi kateri od naju moral z otročkoma kdove kam. ","To je bilo dolgo časa, odkar sem nazadnje padel za mime, ki obljublja sodobno telefonsko industrijo, in je bilo 1996, ko so bili rojeni naši dvojčki, in moja žena je rekla, da bi bilo dobro, da ima mobilni telefon, tako da če bi bilo kakršne koli nepredvidljivosti, smo lahko v stiku tudi, ko je eden od nas moral iti z dvema otrokoma Bog ve, kje."
"To je trajalo nekaj mesecev, tako da sem postal pri iskanju založenega aparata že prav iznajdljiv. Potem pa sva enkrat res morala zvečer ven, na neko vrtno zabavo. Zaradi mobifona sem se moral spraviti celo v suknjič – to me je tako znerviralo, da sva se ob prvi priložnosti opravičila in se odpeljala domov.","To je trajalo nekaj mesecev, zato sem postal precej iznajdljiv, ko iščejo založene naprave, potem pa eno noč smo res morali iti ven na vrtno zabavo, in sem celo moral priti v mojo jakno zaradi mobilnega telefona - da me je tako uničen, da smo se opravičil in odpeljal domov ob prvi priložnosti."
"Stopil sem iz stranišča in odkorakal proti izhodu. Mimogrede sem se oziral po tistem štantu, naredil celo nekaj ovinkov, a hostese z modrimi očmi nisem več opazil. Sicer pa, ali bi jo sploh razpoznal izmed vseh drugih hostes z modrimi očmi.","stopil sem iz stranišča in odšel do izhoda, pogledal na stojnico, celo naredil nekaj zavojev, vendar nisem več opazil hostese z modrimi očmi, ali če bi jo celo prepoznal od vseh drugih hostes z modrimi očmi."
"Prijatelj me je že čakal v predverju. Odpeljala sva se po njegovo prikolico. Medtem ko jo je pripenjal, sem segel po mobifonu, ki ga ima v stojalu. Potežkal sem ga v roki. Odprl sem ga, pritisnil na gumb z zeleno ikono slušalke in odtipkal 21 951 – našo prvo številko.","Prijatelj me je že čakal v preddverju. Zapeljala sva se po njegov priklopnik. Ko ga je pripel, sem segel po mobilnem telefonu, ki ga ima na stojalu. Držal sem ga v roki. Odprl sem ga, pritisnil na gumb z zeleno ikono slušalke in zavrtel 21 951 - našo prvo številko."
